{
  "schema_version": "aud-calibration-result-set-v1", "result_set_id": "CALSET-FIXTURE", "suite_id": "CALSUITE-FIXTURE", "suite_version": "1.0.0", "tier": "fast", "generated_at": "2026-01-01T00:00:00.000Z",
  "results": [{ "schema_version": "aud-calibration-result-v1", "result_id": "CALRES-FIXTURE", "suite_id": "CALSUITE-FIXTURE", "suite_version": "1.0.0", "case_id": "CALCASE-FIXTURE", "case_version": "1.0.0", "input_revision": "abcdef1", "expected_outcome_id": "EXPECTED-FIXTURE", "expected_outcome": { "schema_version": "aud-expected-outcome-v1", "expected_id": "EXPECTED-FIXTURE", "specialist_selection": { "must_include": [], "must_exclude": [] }, "issues": [], "duplicate_groups": [], "relationships": [], "contradictions": [], "root_causes": [], "priorities": [], "remediation_order": [], "verification": [], "regressions": [], "exact": [], "bounded": [] }, "actual_outcome": {}, "verdict": "pass", "checks": [], "unstable_fields": [], "evaluator": { "name": "fixture", "version": "1.0.0", "source_revision": "abcdef1" }, "evaluated_at": "2026-01-01T00:00:00.000Z" }]
}
